{
  "ir_version": "0.2",
  "format": "0.2",
  "source": { "file": "system/cabinet.teda" },
  "system": "cabinet",
  "boards": [{ "id": "amp" }, { "id": "ctrl" }],
  "nets": [
    { "id": "GND", "members": ["amp.GND", "ctrl.GND"] },
    { "id": "SYS", "members": ["amp.SYS_IN", "ctrl.SYS_OUT"] }
  ]
}
